{
  "schemaVersion": "1.0.0",
  "id": "muxui:example:pricing-plans-columns",
  "kind": "example",
  "name": "Columns",
  "summary": "Three plan columns that stack, recommended first, below 44rem.",
  "lifecycle": "experimental",
  "complexity": "representative",
  "prerequisites": [],
  "source": "catalog/patterns/pricing-plans/examples/react/columns.tsx"
}
