{"schemaVersion":"1.0.0","id":"muxui:example:input-tags-form-react","kind":"example","name":"InputTags in a form","summary":"Submit the committed tags from controlled state and check that the list is not empty.","lifecycle":"experimental","binding":{"ref":"muxui:component:input-tags#web.react","guidanceImpact":"normative","purposes":["explanation","validation"],"preference":2},"complexity":"representative","prerequisites":[],"source":"catalog/components/input-tags/examples/react/form.tsx"}
