{
  "schemaVersion": "1.0.0",
  "id": "muxui:example:prompt-composer-basic-react",
  "kind": "example",
  "name": "Basic React PromptComposer",
  "summary": "Compose local multiline messages with native validation and caller-owned send, model, file and suggestion actions.",
  "lifecycle": "experimental",
  "binding": {
    "ref": "muxui:component:prompt-composer#web.react",
    "guidanceImpact": "normative",
    "purposes": [
      "generation",
      "explanation",
      "validation"
    ],
    "preference": 0
  },
  "complexity": "minimal",
  "prerequisites": [],
  "source": "catalog/components/prompt-composer/examples/react/basic.tsx"
}
