{"schemaVersion":"1.0.0","id":"muxui:example:token-field-form-react","kind":"example","name":"TokenField in a form","summary":"Submit tokens as repeated entries under one name and reset to the mount-time defaults.","lifecycle":"experimental","binding":{"ref":"muxui:component:token-field#web.react","guidanceImpact":"normative","purposes":["explanation","validation"],"preference":1},"complexity":"representative","prerequisites":[],"source":"catalog/components/token-field/examples/react/form.tsx"}
