{
  "schemaVersion": "1.0.0",
  "id": "muxui:example:color-mode-toggle-basic-react",
  "kind": "example",
  "name": "Basic React ColorModeToggle",
  "summary": "A source-faithful React color-mode-toggle example using the Mux-owned compound API.",
  "lifecycle": "experimental",
  "binding": {
    "ref": "muxui:component:color-mode-toggle#web.react",
    "guidanceImpact": "normative",
    "purposes": [
      "generation",
      "explanation",
      "validation"
    ],
    "preference": 0
  },
  "complexity": "minimal",
  "prerequisites": [],
  "source": "catalog/components/color-mode-toggle/examples/react/basic.tsx"
}
