{
  "schemaVersion": "1.0.0",
  "id": "muxui:example:tag-group-removable-react",
  "kind": "example",
  "name": "Removable TagGroup",
  "summary": "Remove an applied filter by id from a list held in state, update the results in the same step, and show a message when no filters are left.",
  "lifecycle": "experimental",
  "binding": {
    "ref": "muxui:component:tag-group#web.react",
    "guidanceImpact": "normative",
    "purposes": [
      "explanation",
      "validation"
    ],
    "preference": 1
  },
  "complexity": "representative",
  "prerequisites": [],
  "source": "catalog/components/tag-group/examples/react/removable.tsx"
}
