{"schemaVersion":"1.0.0","id":"muxui:example:autocomplete-form-react","kind":"example","name":"Autocomplete in a form","summary":"Name an Autocomplete inside a Form, read the selected suggestion from onSelect, and read the submitted value from the form data.","lifecycle":"experimental","binding":{"ref":"muxui:component:autocomplete#web.react","guidanceImpact":"normative","purposes":["explanation","validation"],"preference":1},"complexity":"representative","prerequisites":[],"source":"catalog/components/autocomplete/examples/react/form.tsx"}
